{"schema_version":"1.0","projects":{"start-campus-sines":{"name":"SINES Data Campus","operator":"Start Campus","country":"Portugal"},"atnorth-fin02":{"name":"FIN02 Espoo","operator":"atNorth","country":"Finland"},"atnorth-den01":{"name":"DEN01 Ballerup","operator":"atNorth","country":"Denmark"},"atnorth-fin04":{"name":"FIN04 Myllykoski","operator":"atNorth","country":"Finland"},"nxn-valencia-nx01":{"name":"Nx01 Valencia","operator":"NxN Datacenters","country":"Spain"},"virtus-wustermark":{"name":"Virtus Wustermark Campus","operator":"Virtus Data Centres","country":"Germany"}},"sources":{"s01":{"url":"https://www.startcampus.pt/press_release_august_2024_1gw","class":"developer","title":"SINES DC 1.2 GW capacity announcement"},"s02":{"url":"https://www.businesswire.com/news/home/20250408371738/en/Start-Campus-Inaugurates-SIN01-Data-Center","class":"developer-release","title":"Start Campus Inaugurates SIN01"},"s03":{"url":"https://www.startcampus.pt/","class":"developer","title":"Start Campus current site"},"s04":{"url":"https://www.startcampus.pt/press_release_august_2024_siemens","class":"developer-oem-announcement","title":"Start Campus / Siemens Energy transformer order"},"s05":{"url":"https://blog.startcampus.pt/a-defining-moment-for-start-campus","class":"developer","title":"A Defining Moment for Start Campus"},"s06":{"url":"https://blog.startcampus.pt/building-europes-ai-future-from-the-atlantic-coast?hs_amp=true","class":"developer","title":"Building Europe’s AI Future from the Atlantic Coast"},"s07":{"url":"https://www.atnorth.com/news/atnorth-to-open-new-15mw-data-center-campus/","class":"developer","title":"atNorth to open new 15MW data center campus"},"s08":{"url":"https://www.atnorth.com/news/atnorth-announces-heat-reuse-partnership-with-kesko-corporation/","class":"developer","title":"atNorth heat reuse partnership with Kesko"},"s09":{"url":"https://www.atnorth.com/news/new-30mw-data-center-in-copenhagen-denmark/","class":"developer","title":"New 30MW data center Copenhagen"},"s10":{"url":"https://www.datacenterdynamics.com/en/news/atnorth-buys-30-hectare-plot-for-data-center-in-langsele-sweden/","class":"trade-press","title":"atNorth buys 30-hectare plot in Långsele"},"s11":{"url":"https://www.atnorth.com/nordic-data-centers/denmark-data-centers/copenhagen-metro-site/","class":"developer","title":"DEN01 Copenhagen metro site"},"s12":{"url":"https://www.atnorth.com/news/atnorth-announces-heat-reuse-enabled-mega-site-in-kouvola/","class":"developer","title":"atNorth announces FIN04 Kouvola"},"s13":{"url":"https://www.datacenterdynamics.com/en/news/atnorth-files-to-expand-planned-data-center-campus-in-kouvola-finland/","class":"trade-press","title":"AtNorth files to expand planned Kouvola campus"},"s14":{"url":"https://www.atnorth.com/nordic-data-centers/finland-data-centers/myllykoski-mega-site/","class":"developer","title":"FIN04 Myllykoski mega site"},"s15":{"url":"https://www.datacenterdynamics.com/en/news/nxn-receives-green-light-for-data-center-in-valencia-spain/","class":"trade-press","title":"NxN receives green light for Valencia data center"},"s16":{"url":"https://www.datacenterdynamics.com/en/news/construction-begins-on-204mw-data-center-campus-outside-berlin-germany/","class":"trade-press","title":"Construction begins on 204MW campus outside Berlin"}},"events":[{"p":"start-campus-sines","m":"sin01-operations","type":"operations","observed":"2024-08-08","status":"forecast","target_start":"2024-10-01","target_end":"2024-12-31","actual":null,"mw":14,"src":"s01","precision":"quarter"},{"p":"start-campus-sines","m":"sin01-operations","type":"operations","observed":"2025-04-04","status":"actual","target_start":null,"target_end":null,"actual":"2024-12-31","mw":26,"src":"s02","precision":"quarter"},{"p":"start-campus-sines","m":"sin01-capacity","type":"capacity","observed":"2026-08-18","status":"actual","target_start":null,"target_end":null,"actual":"2026-08-18","mw":37.5,"src":"s03","precision":"day"},{"p":"start-campus-sines","m":"sin02-ready-for-service","type":"operations","observed":"2024-08-22","status":"forecast","target_start":"2026-01-01","target_end":"2026-12-31","actual":null,"mw":240,"src":"s04","precision":"year"},{"p":"start-campus-sines","m":"sin02-ready-for-service","type":"operations","observed":"2025-11-01","status":"revised_forecast","target_start":"2027-01-01","target_end":"2027-12-31","actual":null,"mw":180,"src":"s05","precision":"year"},{"p":"start-campus-sines","m":"sin02-ready-for-service","type":"operations","observed":"2026-08-18","status":"revised_forecast","target_start":"2027-07-01","target_end":"2027-12-31","actual":null,"mw":200,"src":"s06","precision":"half-year"},{"p":"atnorth-fin02","m":"operations","type":"operations","observed":"2023-02-07","status":"forecast","target_start":"2024-07-01","target_end":"2024-09-30","actual":null,"mw":15,"src":"s07","precision":"quarter"},{"p":"atnorth-fin02","m":"operations","type":"operations","observed":"2025-04-14","status":"actual","target_start":null,"target_end":null,"actual":"2025-04-30","mw":40,"src":"s08","precision":"month"},{"p":"atnorth-den01","m":"operations","type":"operations","observed":"2023-10-10","status":"forecast","target_start":"2024-10-01","target_end":"2024-12-31","actual":null,"mw":30,"src":"s09","precision":"quarter"},{"p":"atnorth-den01","m":"operations","type":"operations","observed":"2024-12-16","status":"revised_forecast","target_start":"2025-04-01","target_end":"2025-06-30","actual":null,"mw":30,"src":"s10","precision":"quarter"},{"p":"atnorth-den01","m":"operations","type":"operations","observed":"2026-01-01","status":"actual","target_start":null,"target_end":null,"actual":"2025-12-31","mw":30,"src":"s11","precision":"quarter"},{"p":"atnorth-fin04","m":"operations","type":"operations","observed":"2023-12-07","status":"forecast","target_start":"2025-07-01","target_end":"2025-12-31","actual":null,"mw":60,"src":"s12","precision":"half-year"},{"p":"atnorth-fin04","m":"operations","type":"operations","observed":"2026-02-09","status":"revised_forecast","target_start":"2027-01-01","target_end":"2027-06-30","actual":null,"mw":430,"src":"s13","precision":"half-year"},{"p":"atnorth-fin04","m":"operations","type":"operations","observed":"2026-02-09","status":"conflicting_forecast","target_start":"2026-01-01","target_end":"2026-06-30","actual":null,"mw":430,"src":"s14","precision":"half-year"},{"p":"nxn-valencia-nx01","m":"operations","type":"operations","observed":"2024-05-01","status":"forecast","target_start":"2026-01-01","target_end":"2026-12-31","actual":null,"mw":6,"src":"s15","precision":"year"},{"p":"nxn-valencia-nx01","m":"operations","type":"operations","observed":"2025-03-03","status":"revised_forecast","target_start":"2027-04-01","target_end":"2027-09-30","actual":null,"mw":6,"src":"s15","precision":"half-year"},{"p":"virtus-wustermark","m":"operations","type":"operations","observed":"2026-04-16","status":"delayed","target_start":"2026-01-01","target_end":"2026-12-31","actual":null,"mw":204,"src":"s16","precision":"year"}]}