{"schema_version":"1.0","projects":{"equinix-madrid-3x1":{"name":"Equinix Madrid 3x-1","operator":"Equinix","country":"Spain"},"equinix-frankfurt-9x2":{"name":"Equinix Frankfurt 9x-2","operator":"Equinix","country":"Germany"},"equinix-london-11x2":{"name":"Equinix London 11x-2","operator":"Equinix","country":"United Kingdom"},"equinix-ls2":{"name":"Equinix LS2 Lisbon Phase 1","operator":"Equinix","country":"Portugal"},"equinix-md5-phase1":{"name":"Equinix MD5 Phase 1","operator":"Equinix","country":"Spain"}},"sources":{"s28":{"url":"https://www.datacenterdynamics.com/en/news/colo-result-q3-2022-digital-realty-equinix-american-tower/","class":"trade-press","title":"Colo results Q3 2022: Equinix, Digital Realty, American Tower"},"s30":{"url":"https://www.datacenterdynamics.com/en/news/colo-results-q4-2021-digital-realty-equinix-cyrusone/","class":"trade-press","title":"Colo & Wholesale Results Q4 2021"},"s31":{"url":"https://www.datacenterdynamics.com/en/news/colo-results-q4-2022-digital-realty-equinix-iron-mountain/","class":"trade-press","title":"Colo results Q4 2022"},"s32":{"url":"https://www.datacenterdynamics.com/en/news/colo-results-q1-2023-equinix-digital-realty-american-tower-iron-mountain-cyxtera/","class":"trade-press","title":"Colo results Q1 2023"},"s33":{"url":"https://www.datacenterdynamics.com/en/news/q4-2023-colo-earnings-digital-realty-equinix/","class":"trade-press","title":"Q4 2023 colo earnings"},"s36":{"url":"https://www.sec.gov/Archives/edgar/data/1101239/000162828024005350/eqix-20231231.htm","class":"company-filing","title":"Equinix 2023 Form 10-K"},"s37":{"url":"https://www.sec.gov/Archives/edgar/data/1101239/000162828025005126/eqix-20241231.htm","class":"company-filing","title":"Equinix 2024 Form 10-K"},"s38":{"url":"https://www.sec.gov/Archives/edgar/data/1101239/000110123926000032/eqix-20251231.htm","class":"company-filing","title":"Equinix 2025 Form 10-K"},"s40":{"url":"https://newsroom.equinix.com/2024-06-05-Equinix-construye-un-nuevo-data-center-en-Lisboa-con-una-inversion-inicial-de-50-millones-de-euros","class":"developer-release","title":"Equinix announces LS2 Lisbon"},"s41":{"url":"https://www.datacenterdynamics.com/es/noticias/equinix-abre-su-segundo-data-center-en-lisboa/","class":"trade-press","title":"Equinix opens LS2 Lisbon"}},"events":[{"p":"equinix-madrid-3x1","m":"operations","type":"operations","observed":"2022-02-21","status":"forecast","target_start":"2022-07-01","target_end":"2022-09-30","actual":null,"mw":null,"src":"s30","precision":"quarter"},{"p":"equinix-madrid-3x1","m":"operations","type":"operations","observed":"2022-11-03","status":"revised_forecast","target_start":"2022-10-01","target_end":"2022-12-31","actual":null,"mw":null,"src":"s28","precision":"quarter"},{"p":"equinix-madrid-3x1","m":"operations","type":"operations","observed":"2023-02-23","status":"revised_forecast","target_start":"2023-01-01","target_end":"2023-03-31","actual":null,"mw":null,"src":"s31","precision":"quarter"},{"p":"equinix-madrid-3x1","m":"operations","type":"operations","observed":"2023-05-05","status":"revised_forecast","target_start":"2023-04-01","target_end":"2023-06-30","actual":null,"mw":null,"src":"s32","precision":"quarter"},{"p":"equinix-madrid-3x1","m":"operations","type":"operations","observed":"2024-02-29","status":"actual","target_start":null,"target_end":null,"actual":"2023-12-31","mw":null,"src":"s33","precision":"quarter"},{"p":"equinix-frankfurt-9x2","m":"operations","type":"operations","observed":"2022-02-21","status":"forecast","target_start":"2022-07-01","target_end":"2022-09-30","actual":null,"mw":null,"src":"s30","precision":"quarter"},{"p":"equinix-frankfurt-9x2","m":"operations","type":"operations","observed":"2022-11-03","status":"actual","target_start":null,"target_end":null,"actual":"2022-09-30","mw":null,"src":"s28","precision":"quarter"},{"p":"equinix-london-11x2","m":"operations","type":"operations","observed":"2022-02-21","status":"forecast","target_start":"2022-10-01","target_end":"2022-12-31","actual":null,"mw":null,"src":"s30","precision":"quarter"},{"p":"equinix-london-11x2","m":"operations","type":"operations","observed":"2022-11-03","status":"actual","target_start":null,"target_end":null,"actual":"2022-09-30","mw":null,"src":"s28","precision":"quarter"},{"p":"equinix-ls2","m":"operations","type":"operations","observed":"2024-02-16","status":"forecast","target_start":"2025-01-01","target_end":"2025-03-31","actual":null,"mw":null,"src":"s36","precision":"quarter"},{"p":"equinix-ls2","m":"operations","type":"operations","observed":"2024-06-05","status":"forecast","target_start":"2025-01-01","target_end":"2025-03-31","actual":null,"mw":null,"src":"s40","precision":"quarter"},{"p":"equinix-ls2","m":"operations","type":"operations","observed":"2025-02-12","status":"revised_forecast","target_start":"2025-07-01","target_end":"2025-09-30","actual":null,"mw":null,"src":"s37","precision":"quarter"},{"p":"equinix-ls2","m":"operations","type":"operations","observed":"2025-06-03","status":"actual","target_start":null,"target_end":null,"actual":"2025-06-02","mw":null,"src":"s41","precision":"day"},{"p":"equinix-md5-phase1","m":"operations","type":"operations","observed":"2024-02-16","status":"forecast","target_start":"2025-07-01","target_end":"2025-09-30","actual":null,"mw":null,"src":"s36","precision":"quarter"},{"p":"equinix-md5-phase1","m":"operations","type":"operations","observed":"2025-02-12","status":"forecast","target_start":"2025-07-01","target_end":"2025-09-30","actual":null,"mw":null,"src":"s37","precision":"quarter"},{"p":"equinix-md5-phase1","m":"operations","type":"operations","observed":"2026-02-11","status":"revised_forecast","target_start":"2026-04-01","target_end":"2026-06-30","actual":null,"mw":null,"src":"s38","precision":"quarter"}]}