{"schema_version":"1.0","projects":{"equinix-ml5-phase2":{"name":"Equinix ML5 Phase 2","operator":"Equinix","country":"Italy"},"equinix-ma5-phase1":{"name":"Equinix MA5 Phase 1","operator":"Equinix","country":"United Kingdom"},"equinix-md2-phase4":{"name":"Equinix MD2 Phase 4","operator":"Equinix","country":"Spain"},"equinix-pa10-phase1":{"name":"Equinix PA10 Phase 1","operator":"Equinix","country":"France"},"equinix-md6-phase1":{"name":"Equinix MD6 Phase 1","operator":"Equinix","country":"Spain"}},"sources":{"s27":{"url":"https://www.datacenterdynamics.com/en/news/colo-results-q2-2022-equinix-digital-realty-american-tower/","class":"trade-press","title":"Colo results Q2 2022: Equinix, Digital Realty, American Tower"},"s28":{"url":"https://www.datacenterdynamics.com/en/news/colo-result-q3-2022-digital-realty-equinix-american-tower/","class":"trade-press","title":"Colo results Q3 2022: Equinix, Digital Realty, American Tower"},"s29":{"url":"https://www.datacenterdynamics.com/en/news/q3-2023-colo-earnings-digital-realty-equinix-american-tower/","class":"trade-press","title":"Q3 2023 Colo earnings: Digital Realty, Equinix, American Tower"},"s34":{"url":"https://www.sec.gov/Archives/edgar/data/1101239/000162828022003171/eqix-20211231.htm","class":"company-filing","title":"Equinix 2021 Form 10-K"},"s35":{"url":"https://www.sec.gov/Archives/edgar/data/1101239/000162828023004039/eqix-20221231.htm","class":"company-filing","title":"Equinix 2022 Form 10-K"},"s39":{"url":"https://investor.equinix.com/news-events/press-releases/detail/29/equinix-levels-up-uk-digital-economy-with-61-million","class":"developer-release","title":"Equinix announces MA5 Manchester"}},"events":[{"p":"equinix-ml5-phase2","m":"operations","type":"operations","observed":"2022-08-01","status":"forecast","target_start":"2022-07-01","target_end":"2022-09-30","actual":null,"mw":null,"src":"s27","precision":"quarter"},{"p":"equinix-ma5-phase1","m":"operations","type":"operations","observed":"2022-08-01","status":"forecast","target_start":"2022-07-01","target_end":"2022-09-30","actual":null,"mw":null,"src":"s27","precision":"quarter"},{"p":"equinix-md2-phase4","m":"operations","type":"operations","observed":"2022-08-01","status":"forecast","target_start":"2022-07-01","target_end":"2022-09-30","actual":null,"mw":null,"src":"s27","precision":"quarter"},{"p":"equinix-pa10-phase1","m":"operations","type":"operations","observed":"2022-08-01","status":"forecast","target_start":"2022-07-01","target_end":"2022-09-30","actual":null,"mw":null,"src":"s27","precision":"quarter"},{"p":"equinix-md6-phase1","m":"operations","type":"operations","observed":"2022-08-01","status":"forecast","target_start":"2022-07-01","target_end":"2022-09-30","actual":null,"mw":null,"src":"s27","precision":"quarter"},{"p":"equinix-ml5-phase2","m":"operations","type":"operations","observed":"2022-11-03","status":"actual","target_start":null,"target_end":null,"actual":"2022-09-30","mw":null,"src":"s28","precision":"quarter"},{"p":"equinix-ma5-phase1","m":"operations","type":"operations","observed":"2022-11-03","status":"actual","target_start":null,"target_end":null,"actual":"2022-09-30","mw":null,"src":"s28","precision":"quarter"},{"p":"equinix-md2-phase4","m":"operations","type":"operations","observed":"2022-11-03","status":"actual","target_start":null,"target_end":null,"actual":"2022-09-30","mw":null,"src":"s28","precision":"quarter"},{"p":"equinix-pa10-phase1","m":"operations","type":"operations","observed":"2022-11-03","status":"actual","target_start":null,"target_end":null,"actual":"2022-09-30","mw":null,"src":"s28","precision":"quarter"},{"p":"equinix-md6-phase1","m":"operations","type":"operations","observed":"2023-11-01","status":"actual","target_start":null,"target_end":null,"actual":"2023-09-30","mw":null,"src":"s29","precision":"quarter"},{"p":"equinix-ml5-phase2","m":"operations","type":"operations","observed":"2021-02-19","status":"forecast","target_start":"2021-10-01","target_end":"2021-12-31","actual":null,"mw":null,"src":"s34","precision":"quarter"},{"p":"equinix-md2-phase4","m":"operations","type":"operations","observed":"2021-02-19","status":"forecast","target_start":"2022-01-01","target_end":"2022-03-31","actual":null,"mw":null,"src":"s34","precision":"quarter"},{"p":"equinix-ma5-phase1","m":"operations","type":"operations","observed":"2021-02-19","status":"forecast","target_start":"2022-04-01","target_end":"2022-06-30","actual":null,"mw":null,"src":"s34","precision":"quarter"},{"p":"equinix-pa10-phase1","m":"operations","type":"operations","observed":"2021-02-19","status":"forecast","target_start":"2022-04-01","target_end":"2022-06-30","actual":null,"mw":null,"src":"s34","precision":"quarter"},{"p":"equinix-ma5-phase1","m":"operations","type":"operations","observed":"2021-10-27","status":"forecast","target_start":"2022-04-01","target_end":"2022-06-30","actual":null,"mw":null,"src":"s39","precision":"quarter"},{"p":"equinix-ml5-phase2","m":"operations","type":"operations","observed":"2022-02-18","status":"revised_forecast","target_start":"2022-07-01","target_end":"2022-09-30","actual":null,"mw":null,"src":"s34","precision":"quarter"},{"p":"equinix-ma5-phase1","m":"operations","type":"operations","observed":"2022-02-18","status":"forecast","target_start":"2022-04-01","target_end":"2022-06-30","actual":null,"mw":null,"src":"s34","precision":"quarter"},{"p":"equinix-pa10-phase1","m":"operations","type":"operations","observed":"2022-02-18","status":"forecast","target_start":"2022-04-01","target_end":"2022-06-30","actual":null,"mw":null,"src":"s34","precision":"quarter"},{"p":"equinix-md6-phase1","m":"operations","type":"operations","observed":"2022-02-18","status":"forecast","target_start":"2022-07-01","target_end":"2022-09-30","actual":null,"mw":null,"src":"s34","precision":"quarter"},{"p":"equinix-pa10-phase1","m":"operations","type":"operations","observed":"2023-02-17","status":"actual","target_start":null,"target_end":null,"actual":"2022-09-30","mw":null,"src":"s35","precision":"month"}]}