{"schema_version":"1.0","projects":{"art-data-centres-ennis":{"name":"Art Data Centres Ennis","operator":"Art Data Centres","country":"Ireland"},"aws-cruiserath":{"name":"AWS Cruiserath Road","operator":"Amazon Web Services","country":"Ireland"},"vantage-fra5":{"name":"Vantage FRA5 Groß-Gerau","operator":"Vantage Data Centers","country":"Germany"},"google-mittenwalde":{"name":"Google Mittenwalde","operator":"Google","country":"Germany"},"stack-babenhausen":{"name":"STACK Babenhausen","operator":"STACK Infrastructure","country":"Germany"},"tritax-slough-manor-farm":{"name":"Manor Farm Slough","operator":"Tritax Big Box / Manor Farm Propco","country":"United Kingdom"},"avaio-killala":{"name":"Avaio Killala Business Park","operator":"Avaio Digital Partners","country":"Ireland"},"red-admiral-westmeath":{"name":"Red Admiral Rochfortbridge","operator":"Red Admiral","country":"Ireland"}},"sources":{"s17":{"url":"https://www.datacenterdynamics.com/en/news/16bn-irish-data-center-proposed-in-2019-finally-gets-go-ahead/","class":"trade-press","title":"€1.6bn Irish data center proposed in 2019 finally gets go-ahead"},"s18":{"url":"https://www.datacenterdynamics.com/en/news/aws-gets-greenlight-for-three-data-centers-in-dublin-ireland-again/","class":"trade-press","title":"AWS gets greenlight for three data centers in Dublin, again"},"s19":{"url":"https://www.datacenterdynamics.com/en/news/vantage-denied-permission-for-data-center-outside-frankfurt/","class":"trade-press","title":"Vantage denied permission outside Frankfurt"},"s20":{"url":"https://www.datacenterdynamics.com/en/news/google-pulls-plug-on-planned-data-center-in-berlin-germany/","class":"trade-press","title":"Google pulls plug on planned Berlin data center"},"s21":{"url":"https://www.datacenterdynamics.com/en/news/data-center-project-in-hesse-germany-canceled/","class":"trade-press","title":"STACK project in Hesse canceled"},"s22":{"url":"https://www.datacenterdynamics.com/en/news/147mw-slough-data-center-receives-approval-from-uk-government/","class":"trade-press","title":"147MW Slough data center receives approval"},"s23":{"url":"https://www.datacenterdynamics.com/en/news/httpswwwmorningstarcomnewsalliance-news1773736139798338700tritax-big-box-delays-data-centre-completion-as-awaits-green-light/","class":"trade-press","title":"Approval for 147MW Slough data center delayed"},"s24":{"url":"https://www.datacenterdynamics.com/en/news/data-center-project-opposed-by-sally-rooney-in-county-mayo-ireland-hit-by-delays/","class":"trade-press","title":"County Mayo data center hit by delays"},"s25":{"url":"https://www.datacenterdynamics.com/en/news/irelands-red-admiral-receives-approval-for-600-acre-data-center-and-solar-farm-in-westmeath-ireland/","class":"trade-press","title":"Red Admiral receives approval in Westmeath"},"s26":{"url":"https://eudcmonitor.com/","class":"specialist-monitor","title":"European Data Centre Monitor Q2 2026 briefing"}},"events":[{"p":"art-data-centres-ennis","m":"planning-finality","type":"permitting","observed":"2019-01-01","status":"application","target_start":null,"target_end":null,"actual":null,"mw":200,"src":"s17","precision":"year"},{"p":"art-data-centres-ennis","m":"planning-finality","type":"permitting","observed":"2022-01-01","status":"permission","target_start":null,"target_end":null,"actual":null,"mw":200,"src":"s17","precision":"year"},{"p":"art-data-centres-ennis","m":"planning-finality","type":"permitting","observed":"2026-03-13","status":"actual","target_start":null,"target_end":null,"actual":"2026-03-13","mw":200,"src":"s17","precision":"day"},{"p":"aws-cruiserath","m":"planning-finality","type":"permitting","observed":"2023-01-01","status":"application","target_start":null,"target_end":null,"actual":null,"mw":null,"src":"s18","precision":"year"},{"p":"aws-cruiserath","m":"planning-finality","type":"permitting","observed":"2023-12-31","status":"permission_appealed","target_start":null,"target_end":null,"actual":null,"mw":null,"src":"s18","precision":"year"},{"p":"aws-cruiserath","m":"planning-finality","type":"permitting","observed":"2026-01-02","status":"actual","target_start":null,"target_end":null,"actual":"2026-01-02","mw":null,"src":"s18","precision":"day"},{"p":"vantage-fra5","m":"development","type":"permitting","observed":"2025-01-01","status":"proposal","target_start":null,"target_end":null,"actual":null,"mw":174,"src":"s19","precision":"year"},{"p":"vantage-fra5","m":"development","type":"permitting","observed":"2026-02-09","status":"denied","target_start":null,"target_end":null,"actual":"2026-02-09","mw":174,"src":"s19","precision":"day"},{"p":"google-mittenwalde","m":"development","type":"development","observed":"2022-01-01","status":"land_secured","target_start":null,"target_end":null,"actual":null,"mw":null,"src":"s20","precision":"year"},{"p":"google-mittenwalde","m":"development","type":"development","observed":"2025-07-16","status":"canceled","target_start":null,"target_end":null,"actual":"2025-07-16","mw":null,"src":"s20","precision":"day"},{"p":"stack-babenhausen","m":"development","type":"permitting","observed":"2026-02-01","status":"proposal","target_start":null,"target_end":null,"actual":null,"mw":null,"src":"s21","precision":"month"},{"p":"stack-babenhausen","m":"development","type":"permitting","observed":"2026-07-17","status":"canceled","target_start":null,"target_end":null,"actual":"2026-07-17","mw":null,"src":"s21","precision":"day"},{"p":"tritax-slough-manor-farm","m":"planning-finality","type":"permitting","observed":"2025-02-01","status":"application","target_start":null,"target_end":null,"actual":null,"mw":147,"src":"s22","precision":"month"},{"p":"tritax-slough-manor-farm","m":"planning-finality","type":"permitting","observed":"2026-03-18","status":"decision_delayed","target_start":null,"target_end":null,"actual":null,"mw":147,"src":"s23","precision":"day"},{"p":"tritax-slough-manor-farm","m":"planning-finality","type":"permitting","observed":"2026-06-10","status":"actual","target_start":null,"target_end":null,"actual":"2026-06-10","mw":147,"src":"s22","precision":"day"},{"p":"avaio-killala","m":"planning-finality","type":"permitting","observed":"2024-11-01","status":"application","target_start":null,"target_end":null,"actual":null,"mw":36,"src":"s24","precision":"month"},{"p":"avaio-killala","m":"planning-finality","type":"permitting","observed":"2025-04-25","status":"conditional_permission","target_start":null,"target_end":null,"actual":null,"mw":36,"src":"s24","precision":"day"},{"p":"avaio-killala","m":"planning-finality","type":"permitting","observed":"2025-05-21","status":"permission_appealed","target_start":null,"target_end":null,"actual":null,"mw":36,"src":"s24","precision":"day"},{"p":"red-admiral-westmeath","m":"planning-finality","type":"permitting","observed":"2026-06-02","status":"conditional_permission","target_start":null,"target_end":null,"actual":null,"mw":250,"src":"s25","precision":"day"},{"p":"red-admiral-westmeath","m":"planning-finality","type":"permitting","observed":"2026-07-13","status":"permission_appealed","target_start":null,"target_end":null,"actual":null,"mw":250,"src":"s26","precision":"day"}]}